Filename,Title,Keywords,Category,Releases
img-0001.png,Misty Mountains at Sunrise with Soft Golden Light,"landscape, mountains, sunrise, misty, nature, photography, golden light, clouds, dramatic, wide angle, scenic, outdoors, tranquil, serene, photorealistic, natural, beautiful, peaceful, view, sky, fog, horizon, light, color, atmosphere",nature_landscape,no
img-0002.png,Healthy Mediterranean Breakfast Overhead Flat Lay,"breakfast, mediterranean, healthy, food, flatlay, photography, fruits, granola, bowl, coffee, natural, light, rustic, wooden, table, foodie, lifestyle, cuisine, aesthetic, fresh, delicious, snack, morning, meal, colorful",food_flatlay,no
img-0003.png,Futuristic Artificial Intelligence Neural Network Concept,"artificial, intelligence, neural, network, data, technology, futuristic, glowing, blue, connections, light, streams, sci-fi, aesthetic, dark, background, visual, digital, innovation, science, abstract, design, professional, editorial, concept",tech_ai,no
img-0004.png,Conceptual Financial Growth with Coins and Green Plant,"finance, growth, investment, coins, plant, business, nature, money, wealth, success, chart, economy, prosperity, savings, financial, development, strategy, growth, profit, green, environment, conceptual, editorial, focus, soft light",finance_growth,no
img-0005.png,Elegant Abstract Gradient Background with Flowing Shapes,"abstract, gradient, background, smooth, flowing, shapes, vibrant, pastel, colors, blue, purple, pink, modern, wallpaper, high, resolution, clean, elegant, tech, presentations, websites, design, digital, art, style",abstract_gradient,no
img-0006.png,Futuristic Artificial Intelligence with Glowing Neural Networks,"futuristic, artificial, intelligence, neural, network, glowing, data, technology, sci-fi, connections, light, streams, dark, background, editorial, professional, digital, innovation, abstract, design, computing, virtual, cyber, system, visual",tech_ai,no
img-0007.png,Vibrant Abstract Gradient Background with Smooth Shapes,"abstract, gradient, background, smooth, shapes, vibrant, pastel, colors, blue, purple, pink, modern, wallpaper, high, resolution, clean, elegant, tech, presentations, websites, design, art, digital, style, creative",abstract_gradient,no
